{
  "schemaVersion": 0,
  "registryVersion": "0.1.0",
  "source": {
    "heroAuthoringSchemaVersion": 12,
    "sha256": "e62fabf9609d86d71359a9f4279760316d26e57e3206f4a1055e0d53f9470aa5",
    "sourcePath": "hero-authoring-schema.json",
    "sourceRevision": "fa37737"
  },
  "entities": [
    {
      "key": "Skill",
      "namespace": "TbSkill",
      "kind": "Table",
      "identity": "Id",
      "shared": true,
      "role": "Skill root"
    },
    {
      "key": "EffectGroup",
      "namespace": "EffectGroup",
      "kind": "Virtual",
      "identity": "group_id",
      "shared": true,
      "role": "Ordered effect container"
    },
    {
      "key": "Effect",
      "namespace": "TbEffect",
      "kind": "Table",
      "identity": "Id",
      "shared": false,
      "role": "Effect action row"
    },
    {
      "key": "ConditionGroup",
      "namespace": "ConditionGroup",
      "kind": "Virtual",
      "identity": "group_id",
      "shared": true,
      "role": "Ordered condition container"
    },
    {
      "key": "Condition",
      "namespace": "TbCondition",
      "kind": "Table",
      "identity": "Id",
      "shared": false,
      "role": "Condition row"
    },
    {
      "key": "Buff",
      "namespace": "TbBuff",
      "kind": "Table",
      "identity": "Id",
      "shared": true,
      "role": "Timed state and lifecycle effects"
    },
    {
      "key": "Bullet",
      "namespace": "TbBullet",
      "kind": "Table",
      "identity": "Id",
      "shared": true,
      "role": "Projectile definition"
    },
    {
      "key": "Search",
      "namespace": "TbSearch",
      "kind": "Table",
      "identity": "Id",
      "shared": true,
      "role": "Target search definition"
    },
    {
      "key": "DamagePipeline",
      "namespace": "TbDamagePipeline",
      "kind": "Table",
      "identity": "Id",
      "shared": true,
      "role": "Damage stage sequence"
    },
    {
      "key": "SkillResource",
      "namespace": "TbSkillResource",
      "kind": "Table",
      "identity": "Id",
      "shared": true,
      "role": "Skill presentation resource"
    },
    {
      "key": "Trap",
      "namespace": "TbTrap",
      "kind": "Table",
      "identity": "Id",
      "shared": true,
      "role": "Summoned area behavior root"
    },
    {
      "key": "Hero",
      "namespace": "TbHero",
      "kind": "Table",
      "identity": "Id",
      "shared": false,
      "role": "Skill owner"
    },
    {
      "key": "Item",
      "namespace": "TbItem",
      "kind": "Table",
      "identity": "Id",
      "shared": false,
      "role": "Effect-group root and skill unlock carrier"
    },
    {
      "key": "Soldier",
      "namespace": "TbSoldier",
      "kind": "Table",
      "identity": "Id",
      "shared": false,
      "role": "Skill owner"
    },
    {
      "key": "Building",
      "namespace": "TbBuilding",
      "kind": "Table",
      "identity": "Id",
      "shared": false,
      "role": "Skill owner"
    },
    {
      "key": "Equipment",
      "namespace": "TbEquipment",
      "kind": "Table",
      "identity": "Id",
      "shared": false,
      "role": "Skill owner"
    },
    {
      "key": "HeroUpgrade",
      "namespace": "TbHeroUpgrade",
      "kind": "Table",
      "identity": "Id",
      "shared": false,
      "role": "Hero upgrade and unlock carrier"
    },
    {
      "key": "SoldierUpgrade",
      "namespace": "TbSoldierUpgrade",
      "kind": "Table",
      "identity": "Id",
      "shared": false,
      "role": "Soldier upgrade and unlock carrier"
    },
    {
      "key": "EquipmentUpgrade",
      "namespace": "TbEquipmentUpgrade",
      "kind": "Table",
      "identity": "Id",
      "shared": false,
      "role": "Equipment upgrade and unlock carrier"
    },
    {
      "key": "BattleHeroShop",
      "namespace": "TbBattleHeroShop",
      "kind": "Table",
      "identity": "Id",
      "shared": false,
      "role": "Battle skill unlock table"
    },
    {
      "key": "BattleSoldierLevelUp",
      "namespace": "TbBattleSoldierLevelUp",
      "kind": "Table",
      "identity": "Id",
      "shared": false,
      "role": "Battle soldier skill unlock table"
    },
    {
      "key": "Transmigrator",
      "namespace": "TbTransmigrator",
      "kind": "Table",
      "identity": "Id",
      "shared": false,
      "role": "Default skill carrier"
    },
    {
      "key": "Stage",
      "namespace": "TbStage",
      "kind": "Table",
      "identity": "Id",
      "shared": false,
      "role": "Stage generation and component carrier"
    },
    {
      "key": "RandomBag",
      "namespace": "TbRandomBag",
      "kind": "Table",
      "identity": "Id",
      "shared": true,
      "role": "Random bag definition"
    },
    {
      "key": "RandomSet",
      "namespace": "TbRandomSet",
      "kind": "Table",
      "identity": "Id",
      "shared": true,
      "role": "Random output set"
    },
    {
      "key": "SpawnSet",
      "namespace": "TbSpawnSet",
      "kind": "Table",
      "identity": "Id",
      "shared": true,
      "role": "Spawn set definition"
    },
    {
      "key": "RandomCard",
      "namespace": "TbRandomCard",
      "kind": "Table",
      "identity": "id",
      "shared": true,
      "role": "Random card pool member"
    },
    {
      "key": "Card",
      "namespace": "TbCard",
      "kind": "Table",
      "identity": "Id",
      "shared": true,
      "role": "Card template"
    },
    {
      "key": "Resource",
      "namespace": "TbResource",
      "kind": "Table",
      "identity": "Id",
      "shared": true,
      "role": "Resource path"
    },
    {
      "key": "FunctionComponent",
      "namespace": "TbFunctionComponent",
      "kind": "Table",
      "identity": "Id",
      "shared": true,
      "role": "Runtime function component"
    },
    {
      "key": "ViewFunctionComponent",
      "namespace": "TbViewFunctionComponent",
      "kind": "Table",
      "identity": "Id",
      "shared": true,
      "role": "View function component"
    }
  ],
  "planOperations": [
    "CreateSkill",
    "ModifySkill",
    "AddEffectIntent",
    "ModifyEffectIntent",
    "DeleteEffectIntent",
    "AddConditionIntent",
    "ModifyConditionIntent",
    "DeleteConditionIntent",
    "LinkExisting",
    "RemoveLink",
    "ReorderMembers"
  ],
  "readOnlyTools": [
    "get_capability_context",
    "resolve_asset",
    "get_graph",
    "search_similar_skills",
    "explain_execution_chain"
  ],
  "readOnlyToolContracts": {
    "schemaVersion": 0,
    "contractVersion": "0.1.0",
    "resultSchema": "contracts/read-only-results.schema.json",
    "policy": {
      "mutatesData": false,
      "allowsWrites": false,
      "allowsRawCellAccess": false,
      "requiresEvidence": true,
      "unresolvedNamesReturnCandidates": true
    },
    "tools": [
      {
        "name": "get_capability_context",
        "purpose": "Return the relevant capability-registry slice without reading the full registry into model context.",
        "inputSchema": {
          "type": "object",
          "additionalProperties": false,
          "properties": {
            "query": {
              "type": "string"
            },
            "intent": {
              "type": "string"
            },
            "actionKey": {
              "type": "string"
            },
            "enum": {
              "type": "string"
            },
            "enumValueLimit": {
              "type": "integer",
              "minimum": 1,
              "maximum": 500,
              "description": "Maximum values returned per enum."
            },
            "limit": {
              "type": "integer",
              "minimum": 1,
              "maximum": 500,
              "description": "Maximum results per category."
            }
          }
        },
        "outputSchema": {
          "$ref": "read-only-results.schema.json#/$defs/CapabilityContext"
        }
      },
      {
        "name": "resolve_asset",
        "purpose": "Resolve a stable namespace plus ID, or return all candidates for a display name.",
        "inputSchema": {
          "type": "object",
          "additionalProperties": false,
          "required": [
            "namespace"
          ],
          "properties": {
            "namespace": {
              "type": "string",
              "minLength": 1
            },
            "id": {
              "type": "integer"
            },
            "name": {
              "type": "string",
              "minLength": 1
            },
            "limit": {
              "type": "integer",
              "minimum": 1,
              "maximum": 500
            }
          }
        },
        "outputSchema": {
          "$ref": "read-only-results.schema.json#/$defs/AssetResolution"
        }
      },
      {
        "name": "get_graph",
        "purpose": "Return a bounded graph projection around a root asset.",
        "inputSchema": {
          "type": "object",
          "additionalProperties": false,
          "required": [
            "root"
          ],
          "properties": {
            "root": {
              "type": "string",
              "minLength": 1
            },
            "depth": {
              "type": "integer",
              "minimum": 0,
              "maximum": 5
            },
            "direction": {
              "enum": [
                "out",
                "in",
                "both"
              ]
            },
            "limit": {
              "type": "integer",
              "minimum": 1,
              "maximum": 500,
              "description": "Fallback for nodeLimit and edgeLimit."
            },
            "nodeLimit": {
              "type": "integer",
              "minimum": 1,
              "maximum": 500
            },
            "edgeLimit": {
              "type": "integer",
              "minimum": 1,
              "maximum": 500
            }
          }
        },
        "outputSchema": {